{
  "artifact_type": "parallel-lane-pilot",
  "pilot_id": "PLANES-TASK-122-V102",
  "recorded_at": "2026-08-01T01:55:00.000Z",
  "work_item_id": "TASK-122",
  "work_item_ref": ".aof/tasks/done/TASK-122.json",
  "pilot_status": "completed",
  "parent_multi_actor_pilot_ref": ".aof/artifacts/multi-actor-pilots/TASK-121.json",
  "work_execution_packet_ref": ".aof/artifacts/work-execution-packets/TASK-121.json",
  "lanes": [
    {
      "lane_id": "third-party-validation-contract",
      "goal": "define what an external operator must verify before AOF can claim external runtime validation",
      "owner_actor_ref": "builder",
      "input_refs": [
        "docs/v10.0-release-definition.md",
        ".aof/context/active/release-state-audit.json"
      ],
      "expected_output": "third-party validation contract release surface",
      "output_refs": [
        "docs/v10.1-release-definition.md",
        "docs/v10.1.0-release-notes.md"
      ],
      "verification_refs": [
        ".aof/context/active/release-state-audit.json"
      ],
      "stop_condition": "stop if contract is worded as completed validation",
      "lane_status": "completed"
    },
    {
      "lane_id": "external-proof-boundary",
      "goal": "separate validation contract from external proof, market truth, and production authorization",
      "owner_actor_ref": "guardian",
      "input_refs": [
        "docs/aof-capability-matrix.md",
        "README.md"
      ],
      "expected_output": "explicit external proof and not-proven boundary",
      "output_refs": [
        "README.md",
        "docs/aof-capability-matrix.md",
        "docs/v10.1.0-release-notes.md"
      ],
      "verification_refs": [
        ".aof/artifacts/capability-release-deltas/CRD-TASK-121-V101.json"
      ],
      "stop_condition": "stop if release claims third-party acceptance or market proof",
      "lane_status": "completed"
    }
  ],
  "join_packet": {
    "join_status": "merged",
    "join_decision": "merge",
    "joined_lane_ids": [
      "third-party-validation-contract",
      "external-proof-boundary"
    ],
    "conflict_summary": "No unresolved lane conflict; validation contract and proof boundary are both required.",
    "blocker_summary": "No active blocker for bounded validation contract release; actual third-party validation remains outside scope.",
    "merge_rationale": "Validation contract evidence and not-proven boundary are joined by the v10.1 release definition and Council review.",
    "council_authority": "architecture-council"
  },
  "council_decision_ref": ".aof/artifacts/execution/council-reviews/CREV-TASK-121-V101.json",
  "not_proven": "This v10.2 evidence proves provider pilot selection structure only; it does not prove completed provider integration, provider writes, production safety, or third-party validation completion.",
  "source_task_id": "TASK-122",
  "source_parent_session_id": "SESS-V102-PROVIDER-PILOT-SELECTION",
  "source_decision_record_id": null,
  "notes": null
}
