{
  "artifact_type": "parallel-lane-pilot",
  "pilot_id": "PLP-MRQBQO2D-64TSFK",
  "recorded_at": "2026-07-18T12:09:33.781Z",
  "work_item_id": "TASK-100",
  "work_item_ref": ".aof/tasks/done/TASK-100.json",
  "pilot_status": "completed",
  "parent_multi_actor_pilot_ref": ".aof/artifacts/multi-actor-pilots/TASK-100.json",
  "work_execution_packet_ref": ".aof/artifacts/work-execution-packets/TASK-100.json",
  "lanes": [
    {
      "lane_id": "contract",
      "goal": "define external resource schemas and writers",
      "owner_actor_ref": "builder",
      "input_refs": [
        "docs/v8.0-direction-review.md"
      ],
      "expected_output": "external resource record and use record contracts",
      "output_refs": [
        "schemas/aof-external-runtime-resource-record.schema.json",
        "schemas/aof-external-resource-use-record.schema.json",
        "src/commands/external-runtime-resource-record.js",
        "src/commands/external-resource-use-record.js"
      ],
      "verification_refs": [
        ".aof/artifacts/external-runtime-resources/ERR-QIF-V030.json",
        ".aof/artifacts/external-resource-uses/TASK-100-QIF-V030.json"
      ],
      "stop_condition": "stop if resource/use records omit boundaries or provenance",
      "lane_status": "completed"
    },
    {
      "lane_id": "audit",
      "goal": "verify external resource governance",
      "owner_actor_ref": "guardian",
      "input_refs": [
        ".aof/artifacts/external-runtime-resources/ERR-QIF-V030.json",
        ".aof/artifacts/external-resource-uses/TASK-100-QIF-V030.json"
      ],
      "expected_output": "external-resource-audit and release-state gate",
      "output_refs": [
        "src/commands/external-resource-audit.js",
        "src/commands/release-state-audit.js"
      ],
      "verification_refs": [
        ".aof/artifacts/external-resources/external-resource-audit.json"
      ],
      "stop_condition": "stop if audit cannot fail missing boundaries or unapproved external writes",
      "lane_status": "completed"
    }
  ],
  "join_packet": {
    "join_status": "merged",
    "join_decision": "merge",
    "joined_lane_ids": [
      "contract",
      "audit"
    ],
    "conflict_summary": "no unresolved lane conflict",
    "blocker_summary": "no active blocker",
    "merge_rationale": "contract and audit lanes are independently represented and Council-approved",
    "council_authority": "architecture-council"
  },
  "council_decision_ref": ".aof/artifacts/execution/council-reviews/CREV-TASK-100-V80.json",
  "not_proven": "Parallel lane evidence does not prove autonomous scheduling, external provider execution, or semantic correctness.",
  "source_task_id": "TASK-100",
  "source_parent_session_id": "SESS-V80-EXTERNAL-RESOURCE-RUNTIME",
  "source_decision_record_id": "CREV-TASK-100-V80",
  "notes": null
}
