{
  "artifact_type": "parallel-lane-pilot",
  "pilot_id": "PLP-TASK-130-V109",
  "recorded_at": "2026-08-13T07:50:05.000Z",
  "work_item_id": "TASK-130",
  "work_item_ref": ".aof/tasks/done/TASK-130.json",
  "pilot_status": "ready",
  "parent_multi_actor_pilot_ref": ".aof/artifacts/multi-actor-pilots/TASK-130.json",
  "work_execution_packet_ref": ".aof/artifacts/work-execution-packets/TASK-130.json",
  "lanes": [
    {
      "lane_id": "release-framing",
      "goal": "define provider readiness without overclaiming live execution",
      "owner_actor_ref": "visionary",
      "input_refs": [
        "docs/vnext-roadmap.md"
      ],
      "expected_output": "v10.9 release definition and notes",
      "output_refs": [
        "docs/v10.9-release-definition.md",
        "docs/v10.9.0-release-notes.md"
      ],
      "verification_refs": [
        ".aof/artifacts/execution/role-results/RRES-TASK-130-GUARDIAN.json"
      ],
      "stop_condition": "stop if readiness is described as production execution permission",
      "lane_status": "completed"
    },
    {
      "lane_id": "runtime-verification",
      "goal": "verify capability-first, product value, and release-state gates",
      "owner_actor_ref": "guardian",
      "input_refs": [
        ".aof/artifacts/capability-release-deltas/CRD-TASK-130-V109.json",
        ".aof/artifacts/product-value-evidence/PVE-TASK-130-V109.json"
      ],
      "expected_output": "audit-ready release evidence",
      "output_refs": [
        "docs/v10.9-release-checklist.md"
      ],
      "verification_refs": [
        ".aof/artifacts/release-state/release-state-audit.json"
      ],
      "stop_condition": "stop if release-state-audit fails",
      "lane_status": "completed"
    }
  ],
  "join_packet": {
    "join_status": "ready",
    "join_decision": "merge",
    "joined_lane_ids": [
      "release-framing",
      "runtime-verification"
    ],
    "conflict_summary": "No unresolved lane conflict; both lanes preserve the no-live-execution boundary.",
    "blocker_summary": "Blocked if release-state-audit fails or if release wording claims production execution safety.",
    "merge_rationale": "Release framing and runtime verification jointly support v10.9 as readiness evidence.",
    "council_authority": "architecture-council"
  },
  "council_decision_ref": ".aof/artifacts/execution/council-reviews/CREV-TASK-130-V109.json",
  "not_proven": "Parallel lane evidence proves local release-readiness join only; it does not prove provider integration, external operator acceptance, or market value.",
  "source_task_id": "TASK-130",
  "source_parent_session_id": "SESS-V109-PROVIDER-PILOT-READINESS",
  "source_decision_record_id": null,
  "notes": null
}
