{
  "artifact_type": "parallel-lane-pilot",
  "pilot_id": "PLP-TASK-136-V115",
  "recorded_at": "2026-08-15T01:52:30.000Z",
  "work_item_id": "TASK-136",
  "work_item_ref": ".aof/tasks/done/TASK-136.json",
  "pilot_status": "ready",
  "parent_multi_actor_pilot_ref": ".aof/artifacts/multi-actor-pilots/TASK-136.json",
  "work_execution_packet_ref": ".aof/artifacts/work-execution-packets/TASK-136.json",
  "lanes": [
    {
      "lane_id": "replay-contract",
      "goal": "implement schema and audit command for session contract",
      "owner_actor_ref": "builder",
      "input_refs": [
        ".aof/tasks/done/TASK-136.json"
      ],
      "expected_output": "agent session contract artifacts",
      "output_refs": [
        "schemas/aof-provider-observation-replay-audit.schema.json",
        "src/commands/provider-observation-replay-audit.js"
      ],
      "verification_refs": [
        ".aof/artifacts/provider-observation-replays/provider-observation-replay-audit.json"
      ],
      "stop_condition": "stop if replay lacks session-linkage or permits external write authority",
      "lane_status": "completed"
    },
    {
      "lane_id": "governance-boundary",
      "goal": "verify partial/conflicting validation cannot be overclaimed",
      "owner_actor_ref": "guardian",
      "input_refs": [
        ".aof/artifacts/agent-sessions/SESS-V115-PROVIDER-OBSERVATION-REPLAY.json"
      ],
      "expected_output": "fail-closed session contract regression",
      "output_refs": [
        "test/runtime-core-2.test.js"
      ],
      "verification_refs": [
        ".aof/artifacts/execution/role-results/RRES-TASK-136-GUARDIAN.json"
      ],
      "stop_condition": "stop if conflicting validation can be accepted without escalation",
      "lane_status": "completed"
    }
  ],
  "join_packet": {
    "join_status": "ready",
    "join_decision": "merge",
    "joined_lane_ids": [
      "replay-contract",
      "governance-boundary"
    ],
    "conflict_summary": "No unresolved lane conflict; both lanes preserve read-only provider integration and not-proven boundaries.",
    "blocker_summary": "Blocked if release-state-audit fails or if v11.5 wording implies actual independent third-party validation.",
    "merge_rationale": "Replay contract and governance boundary jointly support v11.5 as confidence-aware session contract evidence.",
    "council_authority": "architecture-council"
  },
  "council_decision_ref": ".aof/artifacts/execution/council-reviews/CREV-TASK-136-V115.json",
  "not_proven": "Parallel lane evidence proves local release-readiness join only; it does not prove provider truth, independent validation, write safety, or market value.",
  "source_task_id": "TASK-136",
  "source_parent_session_id": "SESS-V115-PROVIDER-OBSERVATION-REPLAY",
  "source_decision_record_id": null,
  "notes": null
}
